{
  "tag": "AF",
  "geopoliticalarea": "Afghanistan",
  "travel_transportation": "<p>Road conditions are extremely poor throughout Afghanistan. Travel by road outside of Kabul is especially dangerous. Landmines, improvised explosive devices (IEDs), and armed checkpoints operated by various groups pose significant risks. Aviation safety standards do not meet international norms. U.S. government personnel are prohibited from using local taxis and public transportation.</p>",
  "entry_exit_requirements": "<p>A valid passport and visa are required to enter Afghanistan. The U.S. Embassy in Kabul suspended operations on August 31, 2021. U.S. citizens should not travel to Afghanistan and those in Afghanistan should depart immediately via commercial means if safe to do so. Dual nationals face additional risks as the Taliban may not recognize U.S. citizenship.</p>",
  "local_laws_and_special_circumstances": "<p>Afghanistan is governed under strict Islamic law as interpreted by the Taliban. Music, television, and most forms of entertainment are banned. Women must wear the hijab in public and are banned from most employment and secondary education. LGBTQ+ relationships are criminalized and can result in severe punishment. Photographing government buildings, military installations, and other sensitive sites is prohibited.</p>",
  "health": "<p>Medical facilities are extremely limited throughout Afghanistan and cannot provide adequate care for serious medical conditions. Emergency services are essentially nonexistent outside of Kabul. Travelers should ensure they have comprehensive medical evacuation insurance. Recommended vaccinations include hepatitis A, typhoid, and rabies. Tap water is not safe to drink.</p>",
  "safety_and_security": "<p>Afghanistan remains one of the most dangerous countries in the world. The Taliban controls the country and enforces strict interpretations of Islamic law. Terrorist groups including ISIS-K remain active and regularly conduct attacks in Kabul and other major cities targeting civilians, government officials, and foreigners. Kidnapping for ransom is prevalent. Crime rates are high. U.S. citizens are at high risk of kidnapping and targeted violence.</p>",
  "destination_description": "<p>For more information, see the <a href='https://www.state.gov/u-s-relations-with-afghanistan/'>State Department fact sheet on Afghanistan</a>. The U.S. has no diplomatic representation in Afghanistan following the suspension of Embassy Kabul operations.</p>",
  "travel_embassyAndConsulate": "<p>U.S. Embassy Kabul (operations suspended as of August 31, 2021)<br>Great Masood Road<br>Kabul, Afghanistan<br>Emergency contact: Afghanistan@state.gov</p>",
  "last_update_date": "Last Updated: April 02, 2026"
}
